{
  "version": 2,
  "package": "kits/geostat-kit",
  "secrets": "ops/config",
  "features": { "gcpCredentials": true },
  "compose": {
    "catalog": "ops/compose/catalog.json",
    "syncModules": "apps/api/ops.modules"
  },
  "stack": { "composeDir": "ops/compose/stack" },
  "cli": { "aliases": { "w": "web", "a": "api" } },
  "modules": {
    "web": {
      "role": "ui",
      "type": "node-vite",
      "path": "apps/web",
      "secretsModule": "web"
    },
    "api": {
      "role": "api",
      "type": "java-boot",
      "path": "apps/api",
      "secretsModule": "api",
      "credentials": [
        {
          "file": "gcp-primary.json",
          "mount": "/app/gcp-primary.json",
          "envVar": "GOOGLE_APPLICATION_CREDENTIALS"
        },
        {
          "file": "gcp-secondary.json",
          "mount": "/app/gcp-secondary.json",
          "envVar": "GCP_SECONDARY_CREDENTIALS"
        }
      ]
    }
  },
  "adapters": {
    "gcp": {
      "credentialsFile": "google-credentials.json",
      "containerMount": "/app/google-credentials.json"
    }
  },
  "ci": {
    "integration": "ops/ci/integration-stack.sh",
    "prepareEnv": "kits/geostat-kit/ci/prepare-integration-env.sh",
    "waitHealth": "kits/geostat-kit/ci/wait-health.sh"
  }
}
